{
  "$schema": "../../spec/schema/plugin-manifest-v0.1.schema.json",
  "format": "facetwire.plugin-manifest", "formatVersion": "0.1",
  "plugin": {"id": "org.facetwire.reference.hierarchical-chart-renderer", "version": "0.1.0", "name": "FacetWire Hierarchical Chart Renderer", "vendor": "FacetWire contributors", "licenseSpdx": "MPL-2.0"},
  "abi": {"major": 1, "minimumMinor": 0, "maximumMinor": 0},
  "capabilities": [{"id": "facetwire.renderer.hierarchical-chart", "kind": "facetwire.capability.renderer", "flags": 15, "interfaces": [{"id": "facetwire.renderer.hierarchical-chart.v1", "version": 1}]}],
  "artifacts": [{"target": "any", "profile": "static", "registration": "facetwire_hierarchical_chart_plugin_query"}],
  "permissions": [], "dependencies": [], "extensions": {}
}
