{
  "$schema": "../../spec/schema/plugin-manifest-v0.1.schema.json",
  "format": "facetwire.plugin-manifest",
  "formatVersion": "0.1",
  "plugin": {
    "id": "org.facetwire.reference.flow-layout",
    "version": "0.1.0",
    "name": "FacetWire Flow Layout Renderer",
    "vendor": "FacetWire contributors",
    "licenseSpdx": "MPL-2.0"
  },
  "abi": {"major": 1, "minimumMinor": 0, "maximumMinor": 0},
  "capabilities": [{
    "id": "facetwire.layout.flow",
    "kind": "facetwire.capability.layout",
    "flags": 3,
    "interfaces": [{"id": "facetwire.layout.flow.v1", "version": 1}]
  }],
  "artifacts": [{
    "target": "any",
    "profile": "static",
    "registration": "facetwire_flow_layout_plugin_query"
  }],
  "permissions": [],
  "dependencies": [],
  "extensions": {
    "facetwire.implementation-status": "experimental",
    "facetwire.supported-slice": ["continuous", "block"]
  }
}
